Video title,Video publish time,End screen element clicks,Card clicks,Views from playlist,Comments added,Shares,Likes (vs. dislikes) (%),Dislikes,Likes,Subscribers lost,Subscribers gained,Average percentage viewed (%),Views,Watch time (hours),Subscribers,Average view duration,Impressions,Impressions click-through rate (%)
Highest Chase in ODI History By Pakistan Against Australia | Pakistan vs Australia |ODI | PCB | MM2A,9-Jul-23,46407,6,54,1090,14133,96.33,2285,59924,667,15737,26.94,8615905,675663.0801,15070,0:04:42,138426363,4.97
6️⃣6️⃣6️⃣6️⃣6️⃣6️⃣| Fauji's Power Show Against Kiwis Bowlers | Pakistan vs New Zealand | PCB | M2B2A,2-May-23,21766,0,6,271,20149,96.21,638,16188,116,4734,53.67,2954503,51530.3942,4618,0:01:02,31555785,8.24
Game Changing 18th Over | Iftikhar Ahmed vs Adam Milne | Pakistan vs New Zealand | PCB | M2B2A,17-Apr-23,18454,0,,44,3993,97.13,149,5046,41,1540,56.99,1005510,17669.6142,1499,0:01:03,13185024,6.26
Pakistan Chased the Target of 337 Runs | Shaheens Creates History Over Kiwis | ODI | PCB | M2B2A,21-Jan-24,15834,1,1,258,4505,97.06,519,17160,189,3952,33.03,2309683,141148.4333,3763,0:03:40,34384053,5.55
Highlights | South Africa vs Pakistan | 3rd T20I 2021 | CSA | MJ2A,25-Aug-23,14776,1,5,163,3038,96.52,538,14934,161,2868,30.14,1788851,164725.9146,2707,0:05:31,27855993,5.26
Let's Rewind Pakistan's 1️⃣0️⃣- Wicket Victory | Babar's Century & Rizwan's Power Show | PCB | MU2A,4-Sep-23,14566,2,6,290,3904,98.02,388,19213,179,2651,38.78,1694496,88897.3777,2472,0:03:08,26539074,4.9
6 - 6 - 6 | Shahid Afridi vs Chris Woakes | Pakistan vs England | 2nd T20I 2015 | PCB | MA2A,1-Apr-23,14361,8,15,407,9775,94.93,1350,25293,311,14899,42.64,4690356,236130.073,14588,0:03:01,67653327,4.86
Biggest Fights in HBL PSL History | HBL PSL | MI2A,19-Jan-23,11778,0,1,352,1828,95.47,464,9774,149,1678,47.02,1047720,68277.7057,1529,0:03:54,17340158,4.48
Worst Powerplay By Australia | Pakistan vs Australia | PCB | MA2L,12-Aug-22,10882,0,6,117,1711,96.55,248,6931,110,1523,38.27,1323647,55445.2111,1413,0:02:30,16868342,6.18
Pakistan Wins The ODI Series Against Australia After 20 Long Years | ODI | PCB | MM2A,10-Jul-23,10810,1,39,247,2922,96.91,618,19385,231,3661,27.23,2607606,185980.878,3430,0:04:16,29597139,6.85
Shahid Afridi The HERO | Nail Biting Thriller | Pakistan vs England | PCB | MA2A,1-Apr-23,10066,1,7,303,7729,94.9,951,17713,197,7651,36.23,3553569,193135.5689,7454,0:03:15,64280571,4.41
England All Out on 72 | Pakistan Famous Victory vs England | PCB | MA2T,21-Nov-22,9495,0,,133,1527,97.11,162,5448,49,1286,37.06,1076491,57734.3062,1237,0:03:13,15137451,5.92
Highlights | Pakistan vs West Indies | T20I | PCB | MK2L,19-May-23,9074,2,8,39,4037,94.72,453,8120,91,3687,31.27,1196295,99331.0338,3596,0:04:58,22574350,4.16
Australia All Out on 89 | Historical Win For Pakistan | Australia vs Pakistan | PCB | MA2L,18-Mar-22,8032,1,5,148,2149,95.52,454,9675,145,2331,32.66,1557544,164914.3191,2186,0:06:21,22667797,5.02
Hyderabad ✈️ Ahmedabad | Pakistan Captain is All Set For The ICC Captains Day ©️ | PCB | MA2A,4-Oct-23,7693,3,70,617,2581,98.8,247,20346,137,2420,67.52,1686802,22460.83,2283,0:00:47,12461906,12.32
Another High Scoring Game | Sultans Chase Huge Score | Quetta vs Multan | HBL PSL 2023 | MI2A,15-Feb-24,7683,0,2,116,1401,96.45,349,9484,94,3358,36.56,862059,101827.2298,3264,0:07:05,16006606,3.91
Highlights | South Africa vs Pakistan | ODI | CSA | MJ2A,28-Jun-23,7572,2,15,452,3578,96.95,605,19213,217,4896,27.84,2417673,203451.1215,4679,0:05:02,37759641,5.17
Pakistan vs Australia | 1st T20I Highlights | PCB | MA2E,12-May-21,7220,0,95,56,1364,96.76,148,4419,51,1532,24.1,968582,75407.0433,1481,0:04:40,15672543,5.17
Super Over Thriller Match | Highlights | Pakistan vs Australia | PCB | MA2L,4-Feb-23,6923,2,1,138,3444,94.26,807,13242,120,4387,37.57,1961471,252792.2516,4267,0:07:43,31329854,4.45
150+ KPH | Fastest Bowling Spell Ever By Haris Rauf | HBL PSL 8 | MI2A,15-Mar-23,6558,0,11,52,4870,98.21,49,2682,23,324,67.05,239722,3571.6835,301,0:00:53,2473365,8.13
Chris Gayle Wins Everyone's Heart | HBLPSL | MG2T,6-Jan-22,6532,0,17,76,1276,97.27,139,4945,76,2434,33.17,1143788,51846.291,2358,0:02:43,16894351,5.89
New Zealand Defend Lowest Target Against Pakistan | Pakistan vs New Zealand Test | PCB | MA2L,22-Dec-22,6508,1,4,321,421,97.57,137,5490,70,694,34.99,1007627,47107.0431,624,0:02:48,13262778,6.7
Unbelievable Run Chase By Pakistan | Pakistan vs West Indies | PCB | MA2T,14-Jun-22,6416,2,16,133,4681,96.71,420,12330,169,3423,26.13,2059587,150528.8185,3254,0:04:23,33038203,5.46
Shaheen Shah Afridi's First Over Wicket Obsession | Pakistan vs New Zealand | 1st T20I 2024 | PCB,18-Apr-24,6374,0,2,281,2382,98.72,177,13700,88,2301,65.76,926239,20134.6637,2213,0:01:18,7867433,9.66
Most Thrilling Last Over in T20I Cricket History | Pakistan vs New Zealand | T20I | PCB | M2B2A,17-Sep-23,6152,0,2,111,1725,94.06,468,7415,57,3466,38.27,2198489,83905.5614,3409,0:02:17,19219955,9.12
1st Innings Highlights | Pakistan vs New Zealand | 2nd T20I 2024 | PCB | M2E2A,20-Apr-24,6146,0,16,693,3455,97.73,403,17384,128,3558,49.89,1448474,101569.4107,3430,0:04:12,12718587,9.76
Shaheen Afridi is on Fire | Expensive Last Over |6️⃣4️⃣6️⃣6️⃣| Pakistan vs New Zealand | PCB | M2B2A,5-May-23,5980,2,3,57,4721,96.74,129,3832,35,1102,51.7,662306,11223.8389,1067,0:01:01,8078048,6.51
Father vs Son | Azam Khan vs Shahid Afridi | Azam Khan Huge Sixes | HBL PSL | ML2A,21-Jun-23,5646,2,2,464,1813,95.61,352,7670,105,1222,37.99,2826812,64727.2915,1117,0:01:22,25589270,9.73
AB de Villiers vs Mohammad Amir | Class vs Class | Lahore vs Karachi | HBL PSL | MB2A,31-May-23,5640,4,12,286,5749,98.17,356,19059,173,2711,54.24,1808086,45767.7846,2538,0:01:31,24764010,6.56
Highlights | Pakistan vs England | T20I | PCB | MU1T,11-Nov-22,5571,0,16,92,4914,95.44,545,11402,117,3283,28.79,1370119,113086.3283,3166,0:04:57,14978800,7.23
Highlights | Pakistan vs Australia | ODI | PCB | MM2A,23-Aug-23,5562,0,,210,7675,94.17,971,15677,192,5472,27.74,1703373,123775.2486,5280,0:04:21,19922883,6.97
Pakistan are 71-5 | Then Shahid Afridi Changed the Whole Game | Pakistan vs Sri Lanka | PCB | MA2A,5-Apr-23,5395,0,157,124,953,96.08,172,4215,50,1229,38.65,1248547,65018.0596,1179,0:03:07,13290923,7.72
Which Knock is Best of Fakhar Zaman? | 1️⃣9️⃣3️⃣ OR 1️⃣8️⃣0️⃣*,30-Jul-23,5342,2,3,156,2787,97.09,300,10024,87,2237,31.66,1390829,89052.9969,2150,0:03:50,22876303,4.84
Let's Rewind Pakistan's Record Huge Run Chase | Pakistan vs Australia | 2nd ODI 2022 | PCB | MM2A,24-Mar-23,5335,0,19,81,2137,95.26,284,5713,60,2271,35.84,1303125,67712.6159,2211,0:03:07,19048477,5.48
Highlights | Pakistan vs South Africa | T20I | CSA | MJ2A,12-Feb-23,5282,0,2,71,2011,97.11,189,6349,67,1006,35.12,601975,64591.9989,939,0:06:26,10147668,4.44
Let's Rewind Pakistan's Historic Chase Against Kiwis | Pakistan vs New Zealand | ODI | PCB | M2B2A,24-May-23,5223,0,1418,59,2075,97.54,204,8082,52,1565,35.17,752398,46893.6773,1513,0:03:44,10464468,5.61
Highlights | Pakistan vs West Indies | 1st T20I | PCB | MA2E,17-Apr-21,5012,0,,19,577,96.48,87,2386,16,349,34.43,245680,27210.7798,333,0:06:38,3280068,5.72
Unbelievable Run Chase By Pakistan | Pakistan vs West Indies | PCB | MO2L,7-Jul-23,4993,0,6,109,2033,96.7,360,10538,109,1810,33.52,1052141,99446.558,1701,0:05:40,17268910,4.63
National Anthem of Pakistan | Pakistan vs New Zealand | 1st ODI 2023 | PCB | M2B2A,27-Apr-23,4956,0,4,246,7020,96.5,220,6069,65,1248,57.57,483081,6334.8797,1183,0:00:47,3689540,10.88
PSL 9 | Winning Moments | Multan Sultans vs Islamabad United | Match 34 Final | M1Z2A,18-Mar-24,4954,0,397,110,1937,98.24,63,3517,22,366,51,350892,5667.3948,344,0:00:58,1544915,12.01
Full Highlights | Pakistan vs South Africa | 3rd T20I 2021 | PCB | ME2E,14-Feb-21,4807,0,4,27,2025,94.87,238,4399,63,1148,31.97,491027,44789.8626,1085,0:05:28,7402603,4.62
Shahid Afridi vs Shaheen Shah Afridi | Lahore Qalandars vs Karachi Kings | HBL PSL 2018 | MB2A,30-May-23,4777,0,1,121,3703,97.42,149,5631,47,1208,64.12,893404,18140.4676,1161,0:01:13,11383283,6.86
When Dreams Come True | Shaheen and Amir Bowling Together 🦅 🤩 | DP World ILT20,24-Jan-24,4751,0,3,54,1343,99.5,10,2004,26,236,63.49,205942,2179.1341,210,0:00:38,1098578,10.69
3rd T20I Century By Babar Azam | High Scoring Thriller | Pakistan vs New Zealand |T20I | PCB | M2B2A,22-Oct-23,4705,0,21,68,1260,98.08,134,6829,68,840,31.19,603390,55049.3209,772,0:05:28,8537006,5.38
PSL 9 | 2nd Innings Highlights | Multan Sultans vs Islamabad United | Match 34 Final | M2A1A,18-Mar-24,4664,0,5097,90,768,98.02,53,2620,17,275,62.22,228235,19763.6452,258,0:05:11,1159484,16.99
Naseem Shah & Abrar Ahmed's Crucial Partnership | Pakistan vs New Zealand | Test | PCB | MZ2A,18-May-23,4633,1,5,32,594,98.13,80,4190,49,626,33.55,681987,30891.8812,577,0:02:43,8823473,6.32
Worst Start But Thrilling End | Pakistan vs India | Historical Match Ever | 3rd Test | MA2T,24-Mar-21,4596,0,8,269,1321,95.94,266,6289,80,1291,21.33,716825,75489.5402,1211,0:06:19,12965842,4.43
Beautiful Innings By Imam But Ended With Killer Bouncer | Pakistan vs New Zealand | PCB | MA2E,24-Nov-21,4576,0,33,61,543,95.04,53,1015,41,322,48.94,344835,5109.4961,281,0:00:53,2771516,11.62
Iftikhar Ahmed's 6️⃣ sixes and 3️⃣ fours in a fiery half-century vs New Zealand | PCB | M2B2A,4-Jul-23,4574,3,3,108,3104,98.18,119,6418,57,870,43.96,695653,23700.2488,813,0:02:02,8964248,5.97
PSL 9 | Top Catches in HBL PSL 9 so Far! | M1Z2A,3-Mar-24,4480,0,106,32,819,98.18,17,916,13,120,60.79,89319,1779.8474,107,0:01:11,1090180,6.05
Highlights | Pakistan vs England | T20I | PCB | MU2A,14-Mar-23,4467,0,1,85,1396,96.29,257,6673,44,1393,35.84,628483,63199.3424,1349,0:06:02,7728813,6.01
Fakhar Zaman & Mohammad Rizwan Helps Pakistan to Chase the Target of 3️⃣3️⃣7️⃣ | PCB | M2B2A,2-Nov-23,4318,0,12,48,1009,96.43,206,5557,61,1092,27.72,760553,73857.7777,1031,0:05:49,8797495,6.69
Highlights | Pakistan vs New Zealand | ODI | PCB | M2B2A,9-May-23,4264,0,119,46,3712,95.77,402,9110,87,2262,24.61,1133470,97727.2603,2175,0:05:10,13390713,6.83
Azam Khan vs Mohammad Amir | Mohammad Amir Got Angry 😡🗯 | Epic Scenes in HBL PSL | MI2A,13-Jan-24,4192,0,,51,467,95.26,106,2132,24,412,49.56,501536,16225.2631,388,0:01:56,5664558,7.48
Match Winning Batting By Boom Boom Shahid Afridi | Pakistan vs Sri Lanka | 1st T20I 2013 |PCB | MA2A,15-May-23,4167,0,22,67,4430,96.58,184,5191,51,1319,47.7,673042,28980.4948,1268,0:02:35,6723263,8
Low Scoring But Thrilling End | Unbelievable Victory | Pakistan vs England | T20I | PCB | MU2A,3-Feb-24,4061,0,7,52,939,95.83,253,5807,52,1078,34.04,586879,55381.0918,1026,0:05:39,9367344,4.42
Babar Azam vs Mohammad Amir | Karachi Kings vs Peshawar Zalmi | Match 2 | HBL PSL 8 | MI2A,14-Feb-23,4061,3,3,155,2557,96.66,154,4460,51,697,52.62,621717,15902.0409,646,0:01:32,7322335,7.37
1st Innings Highlights | Peshawar Zalmi vs Islamabad United | Match 13 | HBL PSL 9 | M2A1A,26-Feb-24,4060,0,168,330,2260,98.41,136,8415,75,1076,58.38,530982,44259.4373,1001,0:05:00,4755912,9.99
"Shaheen Shah Afridi Meet Virat Kohli, Chahal, KL Rahul and Rishabh Pant | PCB | MA2L",26-Aug-22,4036,0,124,250,1426,98.97,148,14235,135,2854,37.74,2017853,41456.104,2719,0:01:13,20306041,8.84
A Warm Welcome in Hyderabad as Pakistan Team Land on Indian Shores | #CWC23 | PCB | MA2A,28-Sep-23,4035,0,132,127,1055,98.64,31,2255,8,318,53.43,150876,3717.4548,310,0:01:28,1196196,10.26
Pakistan Vs Australia | 2nd T20I Highlights | PCB | MA2E,26-Aug-21,3933,0,30,55,1085,94.32,318,5283,53,2109,31.54,1070604,104949.0331,2056,0:05:52,23604612,3.71
Shaheen Shah Afridi Blistering Batting Against West Indies | Pakistan vs West Indies | PCB | MO2A,21-May-23,3868,1,5,29,1074,95.62,175,3822,40,1102,45.73,496035,16698.239,1062,0:02:01,5876379,5.9
PSL 9 | 1st Innings Highlights | Peshawar Zalmi vs Quetta Gladiators | Match 25 | M2A1A,8-Mar-24,3800,0,1975,116,1024,98.44,91,5744,44,614,57.01,413115,33689.3896,570,0:04:53,2941715,12.32
Highest Chase in T20I Cricket By Babar Azam & M Rizwan | Pakistan vs West Indies | T20I | PCB | MK2A,2-Oct-23,3792,0,12,375,3708,96.2,806,20395,263,4455,27.61,3391814,275522.4886,4192,0:04:52,46406496,6.03
Quetta Need 4️⃣4️⃣ Runs in 1️⃣8️⃣ Balls | Sarfaraz Ahmed's Show Time | Islamabad vs Quetta | ML2A,21-Jun-23,3722,2,,49,473,98.32,43,2511,25,192,47.44,209832,9097.1239,167,0:02:36,3131491,5.29
2nd Innings Highlights | Lahore Qalandars vs Karachi Kings | Match 10 | HBL PSL 9 | M2A1A,24-Feb-24,3673,0,107,98,830,97.83,65,2926,39,490,56.33,284085,22671.3136,451,0:04:47,2803553,8.97
2nd Innings Highlights | Pakistan vs New Zealand | 5th T20I 2024 | PCB | M2E2A,27-Apr-24,3659,0,4,259,1145,97.05,175,5754,39,826,50.24,673589,47937.342,787,0:04:16,7401637,7.71
Shahid Afridi vs Harbhajan Singh | 6️⃣ Balls 6️⃣ Sixes | 6️⃣-6️⃣-6️⃣-6️⃣-6️⃣-6️⃣ | PCB | MA2A,23-Jul-23,3601,0,,128,2679,95.53,223,4765,50,1335,67.68,943825,17212.3463,1285,0:01:05,10819464,7.57
Shahid Afridi Always Performs Well in Crucial Stage | Pakistan vs New Zealand | 4th ODI | PCB | MA2A,28-Mar-23,3588,1,4,64,1268,95.98,152,3632,46,1318,38.33,795224,40725.1606,1272,0:03:04,11708316,5.64
Pakistan vs Australia | 3rd T20I Highlights | PCB | MA2E,27-Aug-21,3550,0,3,8,467,93.93,123,1904,20,843,28.62,485277,45179.7708,823,0:05:35,6643809,5.81
Match Saving 196 By Babar Azam Against Australia | Pakistan vs Australia | 2nd Test 2022 |PCB | MM2L,27-Nov-22,3538,0,,84,3314,98.55,75,5105,32,634,34.31,328434,20655.9532,602,0:03:46,4246374,6.35
2nd Innings Highlights | Pakistan vs New Zealand | 4th T20I 2024 | PCB | M2E2A,25-Apr-24,3511,0,2,890,901,96.48,197,5395,72,853,49.29,641240,45563.1775,781,0:04:15,6219377,9.19
Mohammad Amir's Magical 1st Over in HBL PSL History | Peshawar vs Karachi | HBL PSL | MB2A,15-Jun-23,3495,0,9,117,3250,97.42,147,5541,66,718,40.88,1167503,32880.772,652,0:01:41,14015943,7.41
Target 300 & Pakistan 4-82 | Great Fight By PAK | Pakistan vs New Zealand | 4th ODI 2014 |PCB | MA2A,8-Apr-23,3475,1,4,39,998,95.88,149,3467,44,597,40.13,676130,39267.7768,553,0:03:29,9402139,6.06
Gladiators Created History | High Scoring PSL Match | Quetta vs Peshawar | HBL PSL 2023 | MI2A,14-Feb-24,3390,0,1,147,1646,97.14,259,8810,97,2481,33.06,700065,64158.29,2384,0:05:29,12266393,4.54
4️⃣-6️⃣-4️⃣-4️⃣-4️⃣ | Babar Azam vs Hunain Shah | Peshawar Zalmi vs Islamabad United | M2A1A,26-Feb-24,3360,0,63,78,637,98.9,26,2334,26,235,51.85,242756,6713.5653,209,0:01:39,2815454,7.22
Shaheen Shah Afridi First over Wickets Compilation!,4-Aug-23,3337,3,2,60,4129,98.8,42,3461,31,261,41.83,226960,5511.4531,230,0:01:27,2047322,9.03
Fakhar Zaman Played Like Alone Fighter Against Proteas | South Africa vs Pakistan | ODI | CSA | MJ2A,29-May-23,3311,0,2,84,1291,96.57,145,4080,29,858,36.9,542752,43840.1344,829,0:04:50,9532777,4.29
Highlights | Pakistan vs Australia | T20I | PCB | MM2A,21-Aug-23,3291,0,28,198,1591,96.34,312,8201,109,2126,33.36,1046924,96248.3253,2017,0:05:30,11743155,7.96
You Will Love To Watch These Sixes | Azam Khan Sixes | HBL PSL 8 | MI2A,24-Feb-23,3284,0,,94,1587,96.36,102,2698,24,597,54.27,407565,9154.4486,573,0:01:20,5505937,6.46
Wickets in 1st Over | Mohammad Amir vs Shaheen Shah Afridi | HBL PSL | ML2A,22-Jun-23,3275,2,3,534,4270,97.82,277,12417,154,2414,30.67,1859280,78876.6679,2260,0:02:32,25936646,5.47
Fighting Knock By Boom Boom Shahid Afridi | Peshawar vs Karachi | HBL PSL | MB2A,11-Feb-23,3204,0,2,49,1807,97.77,83,3647,37,698,43.71,481869,21649.9424,661,0:02:41,7928788,5.04
Amir & Shaheen Charges vs Kiwis in PP | Pakistan vs New Zealand | 2nd T20I 2024 | PCB | M2E2A,20-Apr-24,3195,0,9,101,472,98.38,38,2307,19,329,61.77,314377,6418.5776,310,0:01:13,2362399,11.79
Highlights | South Africa vs Pakistan | T20I | CSA | MJ2L,1-Jul-23,3176,0,3,185,1116,96.22,314,7994,96,1685,32.48,848588,84216.6362,1589,0:05:57,12306901,5.15
PSL 9 | Top Yorkers in HBL PSL 9 so Far! | M1Z2A,3-Mar-24,3106,0,55,11,858,97.45,13,497,9,50,58.76,48236,897.4671,41,0:01:06,445264,6.55
Historic Super Over | Lahore Qalandars vs Karachi Kings | HBL PSL 2018 | MB2A,25-May-23,3102,3,7,369,3465,95.77,759,17172,226,4710,37.95,3091757,158399.7506,4484,0:03:04,53574531,5.02
🎥 Glimpses From the Pakistan Team Dinner in Hyderabad | PCB | MA2A,1-Oct-23,3093,0,100,266,627,98.19,75,4077,30,519,53.79,319191,6057.0656,489,0:01:08,2548198,11.12
Highlights | Pakistan vs Australia | ODI | PCB | MM2A,29-May-23,3061,0,38,66,3780,95.75,285,6415,75,1802,28.14,869092,64064.2892,1727,0:04:25,10944052,6.29
What a Battle! | Haris Takes on Shaheen | Lahore vs Peshawar | Match 33 | HBL PSL 8 | MI2A,18-Mar-23,3030,0,5,19,2526,98.85,14,1205,4,100,63.22,107661,2231.0676,96,0:01:14,1050694,8.2
Low Scoring Thrilling Match | Superb Effort By Pakistan Against Australia | T20I | PCB | MM2A,11-Jul-23,2934,1,3,72,616,95.72,218,4872,55,864,33.53,660508,61027.4376,809,0:05:32,7915866,5.81
Pakistan Chase The Target of 2️⃣9️⃣8️⃣ Runs at Karachi | Pakistan vs Sri Lanka | ODI | PCB | M1D2A,9-Oct-23,2918,1,3,61,1395,96.19,215,5424,50,1084,27.28,864691,74959.6457,1034,0:05:12,11090341,6.07
PSL 9 | Rivalry of PSL | Babar Azam vs Mohammad Amir | Peshawar Zalmi vs Quetta Gladiators | M2A1A,8-Mar-24,2890,0,29,289,625,97.25,92,3250,37,400,51.72,502299,14144.9251,363,0:01:41,5212169,8.47
Babar Azam 122 Against South Africa | Unbelievable Innings | Pakistan vs South Africa | CSA | MJ2L,6-Dec-22,2845,0,,210,5839,98.16,148,7903,68,1129,34.82,600709,52588.2302,1061,0:05:15,10608195,3.99
PSL 9 | 1st Innings Highlights | Multan Sultans vs Islamabad United | Match 34 Final | M2A1A,18-Mar-24,2830,0,6250,58,681,97.46,80,3064,29,337,59.09,291282,24240.9682,308,0:04:59,1644809,15.5
1st Innings Highlights | Pakistan vs New Zealand | 5th T20I 2024 | PCB | M2E2A,27-Apr-24,2805,0,2,176,1165,96.86,191,5883,52,881,50.63,624568,44625.5127,829,0:04:17,5269664,9.97
AB de Villiers Playing 360° Shots | Mr. 360° in HBL PSL | MB2L,10-Feb-23,2792,0,,112,3754,98.56,115,7873,69,1101,44.41,624306,25567.8211,1032,0:02:27,8536417,6.08
PSL 9 | 1st Innings Highlights | Peshawar Zalmi vs Multan Sultans | Match 21 | M2A1A,5-Mar-24,2787,0,125,116,1124,98.63,73,5251,46,664,57.4,404542,32765.4394,618,0:04:51,2663406,13.64
Saim Ayub At His Very Best | Lahore Qalandars vs Peshawar Zalmi | Match 15 | HBL PSL 8 | MI2A,27-Feb-23,2755,0,,42,1884,98.77,42,3376,20,440,61.47,423298,8529.2571,420,0:01:12,4586967,7.9
2nd Innings Highlights | Peshawar Zalmi vs Islamabad United | Match 13 | HBL PSL 9 | M2A1A,26-Feb-24,2747,0,100,114,1403,97.98,103,4993,51,762,53.62,454047,34287.8382,711,0:04:31,4059919,9.83
Full Highlights | Pakistan vs England | 1st T20I 2022 | PCB | MA2L,21-Sep-22,2735,0,1,41,1602,94.62,238,4183,30,1110,41.99,677542,76576.8261,1080,0:06:46,9562556,5.08
Blistering Knock By Saim Ayub | Peshawar Zalmi vs Quetta Gladiators | Match 25 | HBL PSL 8 | MI2A,9-Mar-23,2701,0,1,18,1311,99.21,10,1249,6,127,62.3,137973,2793.776,121,0:01:12,1182802,9.47
1st Innings Highlights | Lahore Qalandars vs Multan Sultans | Match 14 | HBL PSL 9 | M2A1A,27-Feb-24,2694,0,121,44,702,98.04,65,3243,58,463,56.05,298436,23927.821,405,0:04:48,2271158,11.87
1st Innings Highlights | Lahore Qalandars vs Quetta Gladiators | Match 4 | HBL PSL 9 | M2A1A,19-Feb-24,2691,0,167,61,892,97.62,67,2753,57,721,50.11,266439,18137.1024,664,0:04:05,2702220,8.91
Shaheen and Amir Star in Powerplay | Gulf Giants vs Desert Vipers | Match 7 | DP World ILT20,24-Jan-24,2624,0,4,62,1418,99.05,29,3037,21,474,70.39,224849,2593.9412,453,0:00:41,1255811,13.44
PSL 9 | Shan Masood vs Shadab Khan 😡🤬 | Islamabad United vs Karachi Kings | Match 24 | M1Z2A,7-Mar-24,2610,0,476,123,828,98.53,36,2418,22,220,67.89,253027,5534.8555,198,0:01:18,2501430,8.71
Heavy Fight | Kieron Pollard vs Shaheen Afridi | Lahore vs Multan | Match 31 | HBL PSL 8 | MI2A,15-Mar-23,2577,0,13,71,2064,97.78,37,1633,22,257,59.59,353937,6912.6238,235,0:01:10,3667067,8.48
Match Winning Knock By Fakhar Zaman | Pakistan vs New Zealand | 2nd ODI 2023 | PCB | M2B2A,29-Apr-23,2567,0,2,31,4839,98.13,43,2254,12,442,51.81,275148,5543.6197,430,0:01:12,2159726,11.46
PSL 9 | 2nd Innings Highlights | Islamabad United vs Multan Sultans | Match 27 | M2A1A,10-Mar-24,2492,0,1220,117,942,98.48,65,4207,41,401,56.33,274163,22394.4768,360,0:04:54,2207900,10.71
Shadab Khan vs M Haris | Mr. Google is on Fire | Islamabad vs Peshawar | Match 29 | HBL PSL 8 | MI2A,12-Mar-23,2483,0,4,9,869,98.83,11,930,4,89,61.88,79100,1427.636,85,0:01:04,731113,8.9
3️⃣rd. T20I Century 💯 By King Babar Azam Against Kiwis 2023 | Pakistan vs New Zealand | PCB | M2B2A,6-Jun-23,2476,0,2,149,17883,98.68,75,5613,33,1271,38.68,336916,8940.6455,1238,0:01:35,3028983,9.82
Abrar Ahmed Should Be Selected For World Cup 2023 | Rewinding His 11 Wicket Haul on Debut | MY2A,18-Sep-23,2474,1,99,254,396,98.82,39,3255,38,284,30.42,302457,11603.4625,246,0:02:18,2582743,8.48
Babar Azam & Co. Creates History | South Africa vs Pakistan | 3rd ODI 2021 | CSA | MJ2A,1-Jan-24,2474,0,3,51,534,96.78,106,3184,32,373,30.93,353857,29607.7976,341,0:05:01,6389992,4.43
2nd Innings Highlights | Lahore Qalandars vs Islamabad United | Match 1 | HBL PSL 9 | M2A1A,17-Feb-24,2462,0,361,94,891,97.4,72,2698,53,1089,40.01,316060,17670.1069,1036,0:03:21,3216622,8.79
1st Innings Highlights | Lahore Qalandars vs Karachi Kings | Match 10 | HBL PSL 9 | M2A1A,24-Feb-24,2461,0,132,72,678,98.05,55,2760,39,496,48.94,274353,19470.8069,457,0:04:15,2528676,9.74
Stunning Last-Over Win | Highlights | Pakistan vs England | T20I | PCB | MU1T,12-Nov-22,2459,0,18,11,1059,96.84,101,3091,34,458,28.22,329199,27637.8884,424,0:05:02,3712304,7.11
1st Innings Highlights | Lahore Qalandars vs Islamabad United | Match 1 | HBL PSL 9 | M2A1A,17-Feb-24,2449,0,451,62,1186,97.72,88,3773,70,1655,46.24,292961,18700.7586,1585,0:03:49,2638229,10.05
Haris Sohail & Boom Boom Shahid Afridi's Match Winning Knock Against New Zealand at Dubai | M2C2A,15-Jan-24,2444,0,12,38,762,95.37,184,3791,39,1229,32.33,927669,43149.8565,1190,0:02:47,27081331,3.01
Full Highlights | Multan Sultans vs Peshawar Zalmi | Final Match 34 | HBL PSL 6 | MB2T,9-Feb-22,2377,0,5,49,1181,97.25,179,6327,87,1331,28.35,504146,50902.0901,1244,0:06:03,9380189,4.27
Highest Chase in HBL PSL History | Jason Roy The Real Hero | The Real Game Changer | PSL | MI2A,8-Jun-23,2367,0,974,108,1334,98.2,112,6109,65,860,33.34,1052711,50403.6739,795,0:02:52,14982206,6.55
1st Innings Highlights | Multan Sultans vs Peshawar Zalmi | Match 9 | HBL PSL 9 | M2A1A,23-Feb-24,2312,0,222,79,1051,98.6,60,4233,54,766,51.24,405276,29074.9587,712,0:04:18,3445223,10.53
PSL 9 | 1st Innings Highlights | Islamabad United vs Lahore Qalandars | Match 23 | M2A1A,6-Mar-24,2301,0,222,22,345,98.54,25,1691,12,178,57.06,165328,12971.1112,166,0:04:42,1113884,13.07
2nd Innings Highlights | Multan Sultans vs Lahore Qalandars | Match 7 | HBL PSL 9 | M2A1A,21-Feb-24,2264,0,211,94,915,98.3,47,2715,30,496,52.66,238343,17291.3022,466,0:04:21,2413063,8.5
PSL 9 | Big Ones of PSL History | Babar Azam vs Mohammad Amir | M1Z2A,1-Mar-24,2258,0,799,60,843,97.84,56,2536,18,223,62.2,272743,5419.1302,205,0:01:11,2413914,9.95
PSL 9 | Iftikhar Ahmed vs Jason Roy Heavy Fight | Quetta Gladiators vs Multan Sultans | M1Z2A,12-Mar-24,2252,0,806,309,1291,97.04,62,2034,24,262,53.21,386022,6162.1808,238,0:00:57,1720108,10.88
Thrilling Last Over | High Voltage Match | Pakistan vs South Africa | T20I | PCB | ME2A,25-Jul-23,2246,0,,45,538,95.85,121,2797,47,476,28.33,460320,27241.7241,429,0:03:33,5097668,8.22
Highlights | Pakistan vs New Zealand | T20I | PCB | M2B2A,16-Aug-23,2244,0,1,137,1278,96.09,274,6731,80,1790,31.34,932337,86762.045,1710,0:05:35,13237163,6.17
W - W | 2 Wickets in 2 Balls | Naseem Shah is on Fire | Pakistan vs New Zealand | 1st ODI | MZ2L,9-Jan-23,2216,0,,12,5576,98.15,28,1487,9,317,47.32,161912,2447.4664,308,0:00:54,1707696,8.27
PSL 9 | 2nd Innings Highlights | Peshawar Zalmi vs Islamabad United | Match 33 | M2A1A,16-Mar-24,2205,0,2811,128,802,98,65,3185,19,309,62.77,245111,20643.6338,290,0:05:03,1551877,13.34
Last Over Victory | Shaheen Afridi vs Trent Boult | Desert Vipers vs MI Emirates | DP World ILT20,30-Jan-24,2191,0,5,40,1427,99.02,22,2212,13,244,79.52,189528,2511.7289,231,0:00:47,1709677,9.38
Pakistan Hits Highest Ever ODI Score At Home | Pakistan vs Zimbabwe | 1st ODI 2015 | PCB | M3C2A,29-Jul-23,2185,0,43,10,240,96.86,52,1605,14,275,44.38,219213,13997.2802,261,0:03:49,2674161,6.97
Fastest Century 💯 in HBL PSL History By Usman Khan vs Quetta Gladiators | HBL PSL 2023 | MI2A,27-Jan-24,2140,1,,209,897,97.96,76,3655,31,380,37.43,419817,14664.9169,349,0:02:05,5528119,6.7
Naseem Shah Fantastic Bowling vs New Zealand | PCB | M2B2A,27-Apr-23,2117,0,,42,3740,99.03,24,2447,17,308,65.4,267916,2969.0057,291,0:00:39,2751877,8.64
Pakistan at 8️⃣8️⃣-5️⃣ | Babar Azam Played Like Alone Fighter | Pakistan vs Zimbabwe | PCB | MD2A,5-Aug-23,2080,0,99,121,456,97.27,90,3209,26,373,34.24,378164,24278.8581,347,0:03:51,4141096,7.72
"PSL 9 | Another Twist, Another Drama | Multan Sultans vs Islamabad United | Match 34 Final | M1Z2A",18-Mar-24,2080,0,29,7,98,98.8,5,411,4,51,59.17,49995,977.8459,47,0:01:10,344209,11.49
PSL 9 | Iftikhar Ahmed's Supremacy | Peshawar Zalmi vs Multan Sultans | Match 21 | M1Z2A,5-Mar-24,2062,0,45,16,552,98.05,12,602,1,98,70.11,74283,1490.0464,97,0:01:12,590539,10.05
Pakistan vs Sri Lanka | 2nd ODI Full Match Highlights | PCB | MA2E,20-May-21,2034,0,1,6,275,94.29,44,727,3,176,33.76,140259,15233.1497,173,0:06:30,1324968,8.29
What A Game | Pakistan Vs New Zealand | Highlights | PCB|M8C2,16-Jun-20,1995,0,8,14,905,96.24,58,1484,19,347,28.23,249377,23054.4651,328,0:05:32,2477082,7.85
